{
    "id": "IdAlreadyCreated",
    "customerId": 1,
    "order": {
      "id": 2,
      "totalPrice": 99,
      "description": "Description of seeded payment"
    },
    "status": "created",
    "isApproved": true,
    "createdAt": "2024-01-27T13:50:20.337Z",
    "updatedAt": "2024-01-27T13:50:20.337Z",
    "externalReference": "string",
    "externalMetadata": {
      "externalReference": "string"
    }
  }